{
  "case_id": "criminal_006b",
  "version": "2.0",
  "language": "zh-CN",
  "task_mode": "teaching",
  "domain": {
    "jurisdiction": "中国",
    "case_category": "刑事证据程序",
    "primary_issue_type": "evidence_admissibility",
    "secondary_issue_types": [
      "证据可靠性",
      "不确定性校准"
    ]
  },
  "title": "关键供述的可采性（程序完整并有印证）",
  "source": {
    "source_id": "PAIR06",
    "source_type": "synthetic",
    "citation": "基于原有教学案例、刑法构成要件与证据规则形成的控制变量合成案例",
    "url": "",
    "retrieval_date": "2026-06-16",
    "original_case_number": "",
    "adaptation_type": "minimal_pair_construction",
    "adaptation_notes": "保留同组案件的大部分事实，仅改变一个具有法律意义的关键变量，用于测试模型敏感性；不对应具体自然人或单一真实案件。",
    "anonymized": true
  },
  "case_narrative": {
    "neutral_summary": "被告人辛在三小时讯问中作出有罪供述，完整同步录音录像显示依法告知权利、正常休息饮水且不存在威胁或疲劳审讯。辛供述了尚未公开的赃物藏匿地点，侦查人员据此找到赃物和其指纹，供述细节与现场记录一致。",
    "timeline": [
      {
        "event_id": "T1",
        "order": 1,
        "time_label": "阶段1",
        "content": "辛在三小时讯问中作出有罪供述。；完整同步录音录像显示权利告知和正常讯问过程。；辛供述了未公开的赃物藏匿地点。",
        "fact_ids": [
          "F1",
          "F2",
          "F3"
        ]
      },
      {
        "event_id": "T2",
        "order": 2,
        "time_label": "阶段2",
        "content": "侦查人员据此找到赃物和辛的指纹。；供述细节与现场记录一致。",
        "fact_ids": [
          "F4",
          "F5"
        ]
      }
    ]
  },
  "participants": [
    {
      "participant_id": "P1",
      "role": "defendant",
      "anonymized_name": "被告人",
      "attributes": {
        "说明": "已匿名化"
      }
    },
    {
      "participant_id": "P2",
      "role": "victim",
      "anonymized_name": "被害人",
      "attributes": {
        "说明": "已匿名化"
      }
    }
  ],
  "facts": [
    {
      "fact_id": "F1",
      "content": "辛在三小时讯问中作出有罪供述。",
      "status": "undisputed",
      "asserted_by": [
        "prosecution",
        "defense",
        "defendant"
      ],
      "evidence_ids": [
        "E1",
        "E2"
      ],
      "notes": "已将事实与各方评价分离。"
    },
    {
      "fact_id": "F2",
      "content": "完整同步录音录像显示权利告知和正常讯问过程。",
      "status": "undisputed",
      "asserted_by": [
        "prosecution",
        "defense",
        "defendant"
      ],
      "evidence_ids": [
        "E2"
      ],
      "notes": "已将事实与各方评价分离。"
    },
    {
      "fact_id": "F3",
      "content": "辛供述了未公开的赃物藏匿地点。",
      "status": "undisputed",
      "asserted_by": [
        "prosecution",
        "defense",
        "defendant"
      ],
      "evidence_ids": [
        "E1"
      ],
      "notes": "已将事实与各方评价分离。"
    },
    {
      "fact_id": "F4",
      "content": "侦查人员据此找到赃物和辛的指纹。",
      "status": "undisputed",
      "asserted_by": [
        "prosecution",
        "defense",
        "defendant"
      ],
      "evidence_ids": [
        "E3",
        "E4"
      ],
      "notes": "已将事实与各方评价分离。"
    },
    {
      "fact_id": "F5",
      "content": "供述细节与现场记录一致。",
      "status": "undisputed",
      "asserted_by": [
        "prosecution",
        "defense",
        "defendant"
      ],
      "evidence_ids": [
        "E1",
        "E5"
      ],
      "notes": "已将事实与各方评价分离。"
    }
  ],
  "claims": [
    {
      "claim_id": "C1",
      "actor_role": "prosecution",
      "content": "完整讯问记录和由供述发现的独立物证共同证明供述合法、真实并具有较强证明力。",
      "supporting_evidence_ids": [
        "E1",
        "E2",
        "E3"
      ],
      "claim_status": "asserted"
    },
    {
      "claim_id": "C2",
      "actor_role": "defense",
      "content": "仍需审查录音录像完整性和物证保管链，但目前未发现实质瑕疵。",
      "supporting_evidence_ids": [
        "E1",
        "E2",
        "E3",
        "E4",
        "E5"
      ],
      "claim_status": "asserted"
    },
    {
      "claim_id": "C3",
      "actor_role": "defendant",
      "content": "辛后来称供述是在紧张状态下作出，但未指出具体非法取证行为。",
      "supporting_evidence_ids": [
        "E3"
      ],
      "claim_status": "asserted"
    }
  ],
  "evidence": [
    {
      "evidence_id": "E1",
      "evidence_type": "defendant_statement",
      "content": "有罪供述包含未公开的赃物藏匿地点和作案细节。",
      "source_actor": "侦查机关",
      "collection_context": "课程项目结构化材料",
      "authenticity_status": "confirmed",
      "availability": "full",
      "notes": "内容可由独立证据核验。"
    },
    {
      "evidence_id": "E2",
      "evidence_type": "audio_visual",
      "content": "完整同步录音录像显示权利告知、正常休息饮水和无威胁讯问。",
      "source_actor": "侦查机关",
      "collection_context": "课程项目结构化材料",
      "authenticity_status": "confirmed",
      "availability": "full",
      "notes": "完整还原讯问过程。"
    },
    {
      "evidence_id": "E3",
      "evidence_type": "physical_evidence",
      "content": "依据供述找到的赃物。",
      "source_actor": "侦查机关",
      "collection_context": "课程项目结构化材料",
      "authenticity_status": "confirmed",
      "availability": "full",
      "notes": "来源和保管链完整。"
    },
    {
      "evidence_id": "E4",
      "evidence_type": "inspection_record",
      "content": "赃物表面检出辛的指纹。",
      "source_actor": "鉴定机构",
      "collection_context": "课程项目结构化材料",
      "authenticity_status": "confirmed",
      "availability": "full",
      "notes": "与物证相互印证。"
    },
    {
      "evidence_id": "E5",
      "evidence_type": "inspection_record",
      "content": "现场勘验记录与供述中的位置和方式细节一致。",
      "source_actor": "侦查机关",
      "collection_context": "课程项目结构化材料",
      "authenticity_status": "confirmed",
      "availability": "full",
      "notes": "属于独立客观印证。"
    }
  ],
  "procedure": {
    "current_stage": "case_analysis",
    "completed_actions": [
      "完成材料整理",
      "完成事实—证据—主张分离"
    ],
    "missing_or_disputed_actions": [],
    "evidence_examination": [
      {
        "evidence_id": "E1",
        "status": "examined",
        "notes": "内容可由独立证据核验。"
      },
      {
        "evidence_id": "E2",
        "status": "examined",
        "notes": "完整还原讯问过程。"
      },
      {
        "evidence_id": "E3",
        "status": "examined",
        "notes": "来源和保管链完整。"
      },
      {
        "evidence_id": "E4",
        "status": "examined",
        "notes": "与物证相互印证。"
      },
      {
        "evidence_id": "E5",
        "status": "examined",
        "notes": "属于独立客观印证。"
      }
    ]
  },
  "role_views": {
    "clerk": {
      "fact_ids": [
        "F1",
        "F2",
        "F3",
        "F4",
        "F5"
      ],
      "claim_ids": [
        "C1",
        "C2",
        "C3"
      ],
      "evidence_ids": [
        "E1",
        "E2",
        "E3",
        "E4",
        "E5"
      ],
      "procedure_access": true,
      "notes": "负责保留事实来源与争议状态。"
    },
    "issue_spotter": {
      "fact_ids": [
        "F1",
        "F2",
        "F3",
        "F4",
        "F5"
      ],
      "claim_ids": [
        "C1",
        "C2",
        "C3"
      ],
      "evidence_ids": [
        "E1",
        "E2",
        "E3",
        "E4",
        "E5"
      ],
      "procedure_access": true,
      "notes": "只识别争点，不读取金标准。"
    },
    "prosecutor": {
      "fact_ids": [
        "F1",
        "F2",
        "F3",
        "F4",
        "F5"
      ],
      "claim_ids": [
        "C1",
        "C3"
      ],
      "evidence_ids": [
        "E1",
        "E2",
        "E3",
        "E4",
        "E5"
      ],
      "procedure_access": true,
      "notes": "读取证据而非预写完整答案。"
    },
    "defense_lawyer": {
      "fact_ids": [
        "F1",
        "F2",
        "F3",
        "F4",
        "F5"
      ],
      "claim_ids": [
        "C2",
        "C3"
      ],
      "evidence_ids": [
        "E1",
        "E2",
        "E3",
        "E4",
        "E5"
      ],
      "procedure_access": true,
      "notes": "读取证据而非预写完整答案。"
    },
    "defendant": {
      "fact_ids": [
        "F1",
        "F2",
        "F3",
        "F4",
        "F5"
      ],
      "claim_ids": [
        "C3"
      ],
      "evidence_ids": [
        "E1",
        "E2",
        "E3"
      ],
      "procedure_access": false,
      "notes": "限制为与本人陈述直接相关的材料。"
    },
    "judge": {
      "fact_ids": [
        "F1",
        "F2",
        "F3",
        "F4",
        "F5"
      ],
      "claim_ids": [
        "C1",
        "C2",
        "C3"
      ],
      "evidence_ids": [
        "E1",
        "E2",
        "E3",
        "E4",
        "E5"
      ],
      "procedure_access": true,
      "notes": "可查看双方结构化论证和全部证据。"
    },
    "reviewers": {
      "fact_ids": [
        "F1",
        "F2",
        "F3",
        "F4",
        "F5"
      ],
      "claim_ids": [
        "C1",
        "C2",
        "C3"
      ],
      "evidence_ids": [
        "E1",
        "E2",
        "E3",
        "E4",
        "E5"
      ],
      "procedure_access": true,
      "notes": "可查看双方论证和法官争点表。"
    },
    "foreperson": {
      "fact_ids": [
        "F1",
        "F2",
        "F3",
        "F4",
        "F5"
      ],
      "claim_ids": [
        "C1",
        "C2",
        "C3"
      ],
      "evidence_ids": [
        "E1",
        "E2",
        "E3",
        "E4",
        "E5"
      ],
      "procedure_access": true,
      "notes": "汇总两轮评议，不读取金标准。"
    },
    "writer": {
      "fact_ids": [
        "F1",
        "F2",
        "F3",
        "F4",
        "F5"
      ],
      "claim_ids": [
        "C1",
        "C2",
        "C3"
      ],
      "evidence_ids": [
        "E1",
        "E2",
        "E3",
        "E4",
        "E5"
      ],
      "procedure_access": true,
      "notes": "读取上游结构化输出，不读取金标准。"
    }
  },
  "metadata": {
    "difficulty": "hard",
    "paired_case_id": "criminal_006a",
    "pair_variant": "B",
    "target_capabilities": [
      "争点识别",
      "证据映射",
      "证据缺口发现",
      "不确定性保持",
      "最小对照敏感性"
    ],
    "created_by": [
      "项目组",
      "AI辅助初标",
      "法学背景成员复核"
    ],
    "review_status": "legal_reviewed"
  }
}