{
  "case_id": "criminal_001b",
  "version": "2.0",
  "language": "zh-CN",
  "task_mode": "teaching",
  "domain": {
    "jurisdiction": "中国",
    "case_category": "帮助信息网络犯罪活动",
    "primary_issue_type": "mens_rea",
    "secondary_issue_types": [
      "证据可靠性",
      "不确定性校准"
    ]
  },
  "title": "银行卡出借与主观明知（强证据）",
  "source": {
    "source_id": "PAIR01",
    "source_type": "synthetic",
    "citation": "基于原有教学案例、刑法构成要件与证据规则形成的控制变量合成案例",
    "url": "",
    "retrieval_date": "2026-06-16",
    "original_case_number": "",
    "adaptation_type": "minimal_pair_construction",
    "adaptation_notes": "保留同组案件的大部分事实，仅改变一个具有法律意义的关键变量，用于测试模型敏感性；不对应具体自然人或单一真实案件。",
    "anonymized": true
  },
  "case_narrative": {
    "neutral_summary": "甲将银行卡交给朋友使用，账户出现多笔异常资金流水。完整聊天记录显示对方明确告知资金系网络诈骗所得，甲回复“风险我知道，按说好的给我五千”，随后多次提供验证码，并收到五千元报酬。",
    "timeline": [
      {
        "event_id": "T1",
        "order": 1,
        "time_label": "阶段1",
        "content": "甲将本人银行卡交由他人使用。；涉案账户短期内出现多笔异常转入转出。；完整聊天中对方明确说明资金来自网络诈骗。",
        "fact_ids": [
          "F1",
          "F2",
          "F3"
        ]
      },
      {
        "event_id": "T2",
        "order": 2,
        "time_label": "阶段2",
        "content": "甲回复知悉风险并同意继续提供验证码。；甲收到五千元报酬。",
        "fact_ids": [
          "F4",
          "F5"
        ]
      }
    ]
  },
  "participants": [
    {
      "participant_id": "P1",
      "role": "defendant",
      "anonymized_name": "被告人",
      "attributes": {
        "说明": "已匿名化"
      }
    },
    {
      "participant_id": "P2",
      "role": "victim",
      "anonymized_name": "被害人",
      "attributes": {
        "说明": "已匿名化"
      }
    }
  ],
  "facts": [
    {
      "fact_id": "F1",
      "content": "甲将本人银行卡交由他人使用。",
      "status": "undisputed",
      "asserted_by": [
        "prosecution",
        "defense",
        "defendant"
      ],
      "evidence_ids": [
        "E1",
        "E3"
      ],
      "notes": "已将事实与各方评价分离。"
    },
    {
      "fact_id": "F2",
      "content": "涉案账户短期内出现多笔异常转入转出。",
      "status": "undisputed",
      "asserted_by": [
        "prosecution",
        "defense",
        "defendant"
      ],
      "evidence_ids": [
        "E1"
      ],
      "notes": "已将事实与各方评价分离。"
    },
    {
      "fact_id": "F3",
      "content": "完整聊天中对方明确说明资金来自网络诈骗。",
      "status": "undisputed",
      "asserted_by": [
        "prosecution",
        "defense",
        "defendant"
      ],
      "evidence_ids": [
        "E2"
      ],
      "notes": "已将事实与各方评价分离。"
    },
    {
      "fact_id": "F4",
      "content": "甲回复知悉风险并同意继续提供验证码。",
      "status": "undisputed",
      "asserted_by": [
        "prosecution",
        "defense",
        "defendant"
      ],
      "evidence_ids": [
        "E2"
      ],
      "notes": "已将事实与各方评价分离。"
    },
    {
      "fact_id": "F5",
      "content": "甲收到五千元报酬。",
      "status": "undisputed",
      "asserted_by": [
        "prosecution",
        "defense",
        "defendant"
      ],
      "evidence_ids": [
        "E5"
      ],
      "notes": "已将事实与各方评价分离。"
    }
  ],
  "claims": [
    {
      "claim_id": "C1",
      "actor_role": "prosecution",
      "content": "明确聊天、持续提供验证码及报酬记录共同证明甲具有犯罪明知。",
      "supporting_evidence_ids": [
        "E1",
        "E2",
        "E3"
      ],
      "claim_status": "asserted"
    },
    {
      "claim_id": "C2",
      "actor_role": "defense",
      "content": "甲虽有参与，但是否准确理解全部违法性质仍可讨论。",
      "supporting_evidence_ids": [
        "E1",
        "E2",
        "E3",
        "E4",
        "E5"
      ],
      "claim_status": "asserted"
    },
    {
      "claim_id": "C3",
      "actor_role": "defendant",
      "content": "甲承认提供银行卡和收款，但称没有认真理解聊天内容。",
      "supporting_evidence_ids": [
        "E3"
      ],
      "claim_status": "asserted"
    }
  ],
  "evidence": [
    {
      "evidence_id": "E1",
      "evidence_type": "documentary",
      "content": "银行流水显示涉案账户短期异常流转。",
      "source_actor": "侦查机关",
      "collection_context": "课程项目结构化材料",
      "authenticity_status": "confirmed",
      "availability": "full",
      "notes": "与A案保持一致。"
    },
    {
      "evidence_id": "E2",
      "evidence_type": "electronic_data",
      "content": "完整聊天显示对方明确说明诈骗资金用途，甲表示知悉风险并继续配合。",
      "source_actor": "侦查机关",
      "collection_context": "课程项目结构化材料",
      "authenticity_status": "confirmed",
      "availability": "full",
      "notes": "包含提取报告、账号身份确认和完整上下文。"
    },
    {
      "evidence_id": "E3",
      "evidence_type": "defendant_statement",
      "content": "甲承认提供银行卡，但称没有认真理解聊天内容。",
      "source_actor": "被告人",
      "collection_context": "课程项目结构化材料",
      "authenticity_status": "confirmed",
      "availability": "full",
      "notes": "与客观聊天内容存在矛盾。"
    },
    {
      "evidence_id": "E4",
      "evidence_type": "co_defendant_statement",
      "content": "同案人员称甲知情并约定报酬。",
      "source_actor": "同案人员",
      "collection_context": "课程项目结构化材料",
      "authenticity_status": "confirmed",
      "availability": "full",
      "notes": "与聊天和转账记录相互印证。"
    },
    {
      "evidence_id": "E5",
      "evidence_type": "documentary",
      "content": "转账记录显示甲收到五千元报酬。",
      "source_actor": "侦查机关",
      "collection_context": "课程项目结构化材料",
      "authenticity_status": "confirmed",
      "availability": "full",
      "notes": "时间与聊天约定对应。"
    }
  ],
  "procedure": {
    "current_stage": "case_analysis",
    "completed_actions": [
      "完成材料整理",
      "完成事实—证据—主张分离"
    ],
    "missing_or_disputed_actions": [],
    "evidence_examination": [
      {
        "evidence_id": "E1",
        "status": "examined",
        "notes": "与A案保持一致。"
      },
      {
        "evidence_id": "E2",
        "status": "examined",
        "notes": "包含提取报告、账号身份确认和完整上下文。"
      },
      {
        "evidence_id": "E3",
        "status": "examined",
        "notes": "与客观聊天内容存在矛盾。"
      },
      {
        "evidence_id": "E4",
        "status": "examined",
        "notes": "与聊天和转账记录相互印证。"
      },
      {
        "evidence_id": "E5",
        "status": "examined",
        "notes": "时间与聊天约定对应。"
      }
    ]
  },
  "role_views": {
    "clerk": {
      "fact_ids": [
        "F1",
        "F2",
        "F3",
        "F4",
        "F5"
      ],
      "claim_ids": [
        "C1",
        "C2",
        "C3"
      ],
      "evidence_ids": [
        "E1",
        "E2",
        "E3",
        "E4",
        "E5"
      ],
      "procedure_access": true,
      "notes": "负责保留事实来源与争议状态。"
    },
    "issue_spotter": {
      "fact_ids": [
        "F1",
        "F2",
        "F3",
        "F4",
        "F5"
      ],
      "claim_ids": [
        "C1",
        "C2",
        "C3"
      ],
      "evidence_ids": [
        "E1",
        "E2",
        "E3",
        "E4",
        "E5"
      ],
      "procedure_access": true,
      "notes": "只识别争点，不读取金标准。"
    },
    "prosecutor": {
      "fact_ids": [
        "F1",
        "F2",
        "F3",
        "F4",
        "F5"
      ],
      "claim_ids": [
        "C1",
        "C3"
      ],
      "evidence_ids": [
        "E1",
        "E2",
        "E3",
        "E4",
        "E5"
      ],
      "procedure_access": true,
      "notes": "读取证据而非预写完整答案。"
    },
    "defense_lawyer": {
      "fact_ids": [
        "F1",
        "F2",
        "F3",
        "F4",
        "F5"
      ],
      "claim_ids": [
        "C2",
        "C3"
      ],
      "evidence_ids": [
        "E1",
        "E2",
        "E3",
        "E4",
        "E5"
      ],
      "procedure_access": true,
      "notes": "读取证据而非预写完整答案。"
    },
    "defendant": {
      "fact_ids": [
        "F1",
        "F2",
        "F3",
        "F4",
        "F5"
      ],
      "claim_ids": [
        "C3"
      ],
      "evidence_ids": [
        "E1",
        "E2",
        "E3"
      ],
      "procedure_access": false,
      "notes": "限制为与本人陈述直接相关的材料。"
    },
    "judge": {
      "fact_ids": [
        "F1",
        "F2",
        "F3",
        "F4",
        "F5"
      ],
      "claim_ids": [
        "C1",
        "C2",
        "C3"
      ],
      "evidence_ids": [
        "E1",
        "E2",
        "E3",
        "E4",
        "E5"
      ],
      "procedure_access": true,
      "notes": "可查看双方结构化论证和全部证据。"
    },
    "reviewers": {
      "fact_ids": [
        "F1",
        "F2",
        "F3",
        "F4",
        "F5"
      ],
      "claim_ids": [
        "C1",
        "C2",
        "C3"
      ],
      "evidence_ids": [
        "E1",
        "E2",
        "E3",
        "E4",
        "E5"
      ],
      "procedure_access": true,
      "notes": "可查看双方论证和法官争点表。"
    },
    "foreperson": {
      "fact_ids": [
        "F1",
        "F2",
        "F3",
        "F4",
        "F5"
      ],
      "claim_ids": [
        "C1",
        "C2",
        "C3"
      ],
      "evidence_ids": [
        "E1",
        "E2",
        "E3",
        "E4",
        "E5"
      ],
      "procedure_access": true,
      "notes": "汇总两轮评议，不读取金标准。"
    },
    "writer": {
      "fact_ids": [
        "F1",
        "F2",
        "F3",
        "F4",
        "F5"
      ],
      "claim_ids": [
        "C1",
        "C2",
        "C3"
      ],
      "evidence_ids": [
        "E1",
        "E2",
        "E3",
        "E4",
        "E5"
      ],
      "procedure_access": true,
      "notes": "读取上游结构化输出，不读取金标准。"
    }
  },
  "metadata": {
    "difficulty": "medium",
    "paired_case_id": "criminal_001a",
    "pair_variant": "B",
    "target_capabilities": [
      "争点识别",
      "证据映射",
      "证据缺口发现",
      "不确定性保持",
      "最小对照敏感性"
    ],
    "created_by": [
      "项目组",
      "AI辅助初标",
      "法学背景成员复核"
    ],
    "review_status": "legal_reviewed"
  }
}