{
  "case_id": "criminal_004b",
  "version": "2.0",
  "language": "zh-CN",
  "task_mode": "teaching",
  "domain": {
    "jurisdiction": "中国",
    "case_category": "交通肇事",
    "primary_issue_type": "actus_reus",
    "secondary_issue_types": [
      "证据可靠性",
      "不确定性校准"
    ]
  },
  "title": "路口事故与过失判断（超速和可避免性鉴定）",
  "source": {
    "source_id": "PAIR04",
    "source_type": "synthetic",
    "citation": "基于原有教学案例、刑法构成要件与证据规则形成的控制变量合成案例",
    "url": "",
    "retrieval_date": "2026-06-16",
    "original_case_number": "",
    "adaptation_type": "minimal_pair_construction",
    "adaptation_notes": "保留同组案件的大部分事实，仅改变一个具有法律意义的关键变量，用于测试模型敏感性；不对应具体自然人或单一真实案件。",
    "anonymized": true
  },
  "case_narrative": {
    "neutral_summary": "戊驾车通过限速40公里路口时与变道电动车相撞，被害人死亡。车辆事件数据显示事发前速度为68公里，完整路口视频显示视野清楚，戊直到碰撞前一秒才制动。交通技术鉴定认为若按限速行驶并及时制动，事故具有较高可避免性。",
    "timeline": [
      {
        "event_id": "T1",
        "order": 1,
        "time_label": "阶段1",
        "content": "戊驾驶汽车与变道电动车发生碰撞。；被害人经抢救无效死亡。；戊在限速40公里路段以68公里速度行驶。",
        "fact_ids": [
          "F1",
          "F2",
          "F3"
        ]
      },
      {
        "event_id": "T2",
        "order": 2,
        "time_label": "阶段2",
        "content": "戊在碰撞前一秒才开始制动。；鉴定认为按限速并及时制动可较大概率避免事故。",
        "fact_ids": [
          "F4",
          "F5"
        ]
      }
    ]
  },
  "participants": [
    {
      "participant_id": "P1",
      "role": "defendant",
      "anonymized_name": "被告人",
      "attributes": {
        "说明": "已匿名化"
      }
    },
    {
      "participant_id": "P2",
      "role": "victim",
      "anonymized_name": "被害人",
      "attributes": {
        "说明": "已匿名化"
      }
    }
  ],
  "facts": [
    {
      "fact_id": "F1",
      "content": "戊驾驶汽车与变道电动车发生碰撞。",
      "status": "undisputed",
      "asserted_by": [
        "prosecution",
        "defense",
        "defendant"
      ],
      "evidence_ids": [
        "E1",
        "E2"
      ],
      "notes": "已将事实与各方评价分离。"
    },
    {
      "fact_id": "F2",
      "content": "被害人经抢救无效死亡。",
      "status": "undisputed",
      "asserted_by": [
        "prosecution",
        "defense",
        "defendant"
      ],
      "evidence_ids": [
        "E3"
      ],
      "notes": "已将事实与各方评价分离。"
    },
    {
      "fact_id": "F3",
      "content": "戊在限速40公里路段以68公里速度行驶。",
      "status": "undisputed",
      "asserted_by": [
        "prosecution",
        "defense",
        "defendant"
      ],
      "evidence_ids": [
        "E1"
      ],
      "notes": "已将事实与各方评价分离。"
    },
    {
      "fact_id": "F4",
      "content": "戊在碰撞前一秒才开始制动。",
      "status": "undisputed",
      "asserted_by": [
        "prosecution",
        "defense",
        "defendant"
      ],
      "evidence_ids": [
        "E2"
      ],
      "notes": "已将事实与各方评价分离。"
    },
    {
      "fact_id": "F5",
      "content": "鉴定认为按限速并及时制动可较大概率避免事故。",
      "status": "undisputed",
      "asserted_by": [
        "prosecution",
        "defense",
        "defendant"
      ],
      "evidence_ids": [
        "E4"
      ],
      "notes": "已将事实与各方评价分离。"
    }
  ],
  "claims": [
    {
      "claim_id": "C1",
      "actor_role": "prosecution",
      "content": "明显超速、迟延制动和可避免性鉴定共同证明戊严重违反注意义务并导致死亡结果。",
      "supporting_evidence_ids": [
        "E1",
        "E2",
        "E3"
      ],
      "claim_status": "asserted"
    },
    {
      "claim_id": "C2",
      "actor_role": "defense",
      "content": "被害人变道仍对事故发生有一定贡献，应在责任程度上予以考虑。",
      "supporting_evidence_ids": [
        "E1",
        "E2",
        "E3",
        "E4",
        "E5"
      ],
      "claim_status": "asserted"
    },
    {
      "claim_id": "C3",
      "actor_role": "defendant",
      "content": "戊承认超速，但称被害人变道突然。",
      "supporting_evidence_ids": [
        "E3"
      ],
      "claim_status": "asserted"
    }
  ],
  "evidence": [
    {
      "evidence_id": "E1",
      "evidence_type": "electronic_data",
      "content": "车辆事件数据记录事发前速度为68公里。",
      "source_actor": "交警部门",
      "collection_context": "课程项目结构化材料",
      "authenticity_status": "confirmed",
      "availability": "full",
      "notes": "车辆、时间和设备均已核验。"
    },
    {
      "evidence_id": "E2",
      "evidence_type": "audio_visual",
      "content": "完整路口视频显示视野清楚，戊迟至碰撞前一秒制动。",
      "source_actor": "交警部门",
      "collection_context": "课程项目结构化材料",
      "authenticity_status": "confirmed",
      "availability": "full",
      "notes": "可观察驾驶和制动过程。"
    },
    {
      "evidence_id": "E3",
      "evidence_type": "expert_opinion",
      "content": "死亡原因鉴定确认交通碰撞损伤致死。",
      "source_actor": "鉴定机构",
      "collection_context": "课程项目结构化材料",
      "authenticity_status": "confirmed",
      "availability": "full",
      "notes": "死亡结果明确。"
    },
    {
      "evidence_id": "E4",
      "evidence_type": "expert_opinion",
      "content": "交通技术鉴定认为按限速行驶并及时制动可较大概率避免事故。",
      "source_actor": "鉴定机构",
      "collection_context": "课程项目结构化材料",
      "authenticity_status": "confirmed",
      "availability": "full",
      "notes": "采用现场数据和车辆参数计算。"
    },
    {
      "evidence_id": "E5",
      "evidence_type": "documentary",
      "content": "事故认定书认定戊承担主要责任。",
      "source_actor": "交警部门",
      "collection_context": "课程项目结构化材料",
      "authenticity_status": "confirmed",
      "availability": "full",
      "notes": "与客观技术数据一致。"
    }
  ],
  "procedure": {
    "current_stage": "case_analysis",
    "completed_actions": [
      "完成材料整理",
      "完成事实—证据—主张分离"
    ],
    "missing_or_disputed_actions": [],
    "evidence_examination": [
      {
        "evidence_id": "E1",
        "status": "examined",
        "notes": "车辆、时间和设备均已核验。"
      },
      {
        "evidence_id": "E2",
        "status": "examined",
        "notes": "可观察驾驶和制动过程。"
      },
      {
        "evidence_id": "E3",
        "status": "examined",
        "notes": "死亡结果明确。"
      },
      {
        "evidence_id": "E4",
        "status": "examined",
        "notes": "采用现场数据和车辆参数计算。"
      },
      {
        "evidence_id": "E5",
        "status": "examined",
        "notes": "与客观技术数据一致。"
      }
    ]
  },
  "role_views": {
    "clerk": {
      "fact_ids": [
        "F1",
        "F2",
        "F3",
        "F4",
        "F5"
      ],
      "claim_ids": [
        "C1",
        "C2",
        "C3"
      ],
      "evidence_ids": [
        "E1",
        "E2",
        "E3",
        "E4",
        "E5"
      ],
      "procedure_access": true,
      "notes": "负责保留事实来源与争议状态。"
    },
    "issue_spotter": {
      "fact_ids": [
        "F1",
        "F2",
        "F3",
        "F4",
        "F5"
      ],
      "claim_ids": [
        "C1",
        "C2",
        "C3"
      ],
      "evidence_ids": [
        "E1",
        "E2",
        "E3",
        "E4",
        "E5"
      ],
      "procedure_access": true,
      "notes": "只识别争点，不读取金标准。"
    },
    "prosecutor": {
      "fact_ids": [
        "F1",
        "F2",
        "F3",
        "F4",
        "F5"
      ],
      "claim_ids": [
        "C1",
        "C3"
      ],
      "evidence_ids": [
        "E1",
        "E2",
        "E3",
        "E4",
        "E5"
      ],
      "procedure_access": true,
      "notes": "读取证据而非预写完整答案。"
    },
    "defense_lawyer": {
      "fact_ids": [
        "F1",
        "F2",
        "F3",
        "F4",
        "F5"
      ],
      "claim_ids": [
        "C2",
        "C3"
      ],
      "evidence_ids": [
        "E1",
        "E2",
        "E3",
        "E4",
        "E5"
      ],
      "procedure_access": true,
      "notes": "读取证据而非预写完整答案。"
    },
    "defendant": {
      "fact_ids": [
        "F1",
        "F2",
        "F3",
        "F4",
        "F5"
      ],
      "claim_ids": [
        "C3"
      ],
      "evidence_ids": [
        "E1",
        "E2",
        "E3"
      ],
      "procedure_access": false,
      "notes": "限制为与本人陈述直接相关的材料。"
    },
    "judge": {
      "fact_ids": [
        "F1",
        "F2",
        "F3",
        "F4",
        "F5"
      ],
      "claim_ids": [
        "C1",
        "C2",
        "C3"
      ],
      "evidence_ids": [
        "E1",
        "E2",
        "E3",
        "E4",
        "E5"
      ],
      "procedure_access": true,
      "notes": "可查看双方结构化论证和全部证据。"
    },
    "reviewers": {
      "fact_ids": [
        "F1",
        "F2",
        "F3",
        "F4",
        "F5"
      ],
      "claim_ids": [
        "C1",
        "C2",
        "C3"
      ],
      "evidence_ids": [
        "E1",
        "E2",
        "E3",
        "E4",
        "E5"
      ],
      "procedure_access": true,
      "notes": "可查看双方论证和法官争点表。"
    },
    "foreperson": {
      "fact_ids": [
        "F1",
        "F2",
        "F3",
        "F4",
        "F5"
      ],
      "claim_ids": [
        "C1",
        "C2",
        "C3"
      ],
      "evidence_ids": [
        "E1",
        "E2",
        "E3",
        "E4",
        "E5"
      ],
      "procedure_access": true,
      "notes": "汇总两轮评议，不读取金标准。"
    },
    "writer": {
      "fact_ids": [
        "F1",
        "F2",
        "F3",
        "F4",
        "F5"
      ],
      "claim_ids": [
        "C1",
        "C2",
        "C3"
      ],
      "evidence_ids": [
        "E1",
        "E2",
        "E3",
        "E4",
        "E5"
      ],
      "procedure_access": true,
      "notes": "读取上游结构化输出，不读取金标准。"
    }
  },
  "metadata": {
    "difficulty": "hard",
    "paired_case_id": "criminal_004a",
    "pair_variant": "B",
    "target_capabilities": [
      "争点识别",
      "证据映射",
      "证据缺口发现",
      "不确定性保持",
      "最小对照敏感性"
    ],
    "created_by": [
      "项目组",
      "AI辅助初标",
      "法学背景成员复核"
    ],
    "review_status": "legal_reviewed"
  }
}