{
  "case_id": "criminal_004a",
  "version": "2.0",
  "language": "zh-CN",
  "task_mode": "teaching",
  "domain": {
    "jurisdiction": "中国",
    "case_category": "交通肇事",
    "primary_issue_type": "actus_reus",
    "secondary_issue_types": [
      "证据可靠性",
      "不确定性校准"
    ]
  },
  "title": "路口事故与过失判断（只有责任认定书）",
  "source": {
    "source_id": "PAIR04",
    "source_type": "synthetic",
    "citation": "基于原有教学案例、刑法构成要件与证据规则形成的控制变量合成案例",
    "url": "",
    "retrieval_date": "2026-06-16",
    "original_case_number": "",
    "adaptation_type": "minimal_pair_construction",
    "adaptation_notes": "保留同组案件的大部分事实，仅改变一个具有法律意义的关键变量，用于测试模型敏感性；不对应具体自然人或单一真实案件。",
    "anonymized": true
  },
  "case_narrative": {
    "neutral_summary": "戊驾车通过路口时与突然变道的电动车相撞，被害人死亡。事故认定书认定戊承担主要责任，但道路监控被遮挡，未提取车辆速度数据，也没有制动和可避免性鉴定。戊称已减速并及时制动，被害人未戴头盔。",
    "timeline": [
      {
        "event_id": "T1",
        "order": 1,
        "time_label": "阶段1",
        "content": "戊驾驶汽车与变道电动车发生碰撞。；被害人经抢救无效死亡。；事故认定书认定戊负主要责任。",
        "fact_ids": [
          "F1",
          "F2",
          "F3"
        ]
      },
      {
        "event_id": "T2",
        "order": 2,
        "time_label": "阶段2",
        "content": "现有监控不能清楚显示戊的速度和制动时点。；被害人突然变道且未佩戴头盔。",
        "fact_ids": [
          "F4",
          "F5"
        ]
      }
    ]
  },
  "participants": [
    {
      "participant_id": "P1",
      "role": "defendant",
      "anonymized_name": "被告人",
      "attributes": {
        "说明": "已匿名化"
      }
    },
    {
      "participant_id": "P2",
      "role": "victim",
      "anonymized_name": "被害人",
      "attributes": {
        "说明": "已匿名化"
      }
    }
  ],
  "facts": [
    {
      "fact_id": "F1",
      "content": "戊驾驶汽车与变道电动车发生碰撞。",
      "status": "undisputed",
      "asserted_by": [
        "prosecution",
        "defense",
        "defendant"
      ],
      "evidence_ids": [
        "E1",
        "E2"
      ],
      "notes": "已将事实与各方评价分离。"
    },
    {
      "fact_id": "F2",
      "content": "被害人经抢救无效死亡。",
      "status": "undisputed",
      "asserted_by": [
        "prosecution",
        "defense",
        "defendant"
      ],
      "evidence_ids": [
        "E3"
      ],
      "notes": "已将事实与各方评价分离。"
    },
    {
      "fact_id": "F3",
      "content": "事故认定书认定戊负主要责任。",
      "status": "undisputed",
      "asserted_by": [
        "prosecution",
        "defense",
        "defendant"
      ],
      "evidence_ids": [
        "E1"
      ],
      "notes": "已将事实与各方评价分离。"
    },
    {
      "fact_id": "F4",
      "content": "现有监控不能清楚显示戊的速度和制动时点。",
      "status": "undisputed",
      "asserted_by": [
        "prosecution",
        "defense",
        "defendant"
      ],
      "evidence_ids": [
        "E2"
      ],
      "notes": "已将事实与各方评价分离。"
    },
    {
      "fact_id": "F5",
      "content": "被害人突然变道且未佩戴头盔。",
      "status": "disputed",
      "asserted_by": [
        "prosecution",
        "defense",
        "defendant"
      ],
      "evidence_ids": [
        "E2",
        "E4"
      ],
      "notes": "已将事实与各方评价分离。"
    }
  ],
  "claims": [
    {
      "claim_id": "C1",
      "actor_role": "prosecution",
      "content": "事故认定书和死亡结果表明戊违反交通运输管理法规并负主要责任。",
      "supporting_evidence_ids": [
        "E1",
        "E2",
        "E3"
      ],
      "claim_status": "asserted"
    },
    {
      "claim_id": "C2",
      "actor_role": "defense",
      "content": "责任认定依据不完整，速度、视距和可避免性均未查明，不能只凭责任认定书确定刑事过失。",
      "supporting_evidence_ids": [
        "E1",
        "E2",
        "E3",
        "E4",
        "E5"
      ],
      "claim_status": "asserted"
    },
    {
      "claim_id": "C3",
      "actor_role": "defendant",
      "content": "戊称自己已减速并制动，被害人突然变道。",
      "supporting_evidence_ids": [
        "E3"
      ],
      "claim_status": "asserted"
    }
  ],
  "evidence": [
    {
      "evidence_id": "E1",
      "evidence_type": "documentary",
      "content": "交通事故认定书认定戊承担主要责任。",
      "source_actor": "交警部门",
      "collection_context": "课程项目结构化材料",
      "authenticity_status": "confirmed",
      "availability": "full",
      "notes": "结论需要结合形成依据审查。"
    },
    {
      "evidence_id": "E2",
      "evidence_type": "audio_visual",
      "content": "道路监控受遮挡，仅能看到碰撞前后部分画面。",
      "source_actor": "交警部门",
      "collection_context": "课程项目结构化材料",
      "authenticity_status": "confirmed",
      "availability": "partial",
      "notes": "不能准确判断速度、视距和制动时点。"
    },
    {
      "evidence_id": "E3",
      "evidence_type": "expert_opinion",
      "content": "死亡原因鉴定确认交通碰撞损伤致死。",
      "source_actor": "鉴定机构",
      "collection_context": "课程项目结构化材料",
      "authenticity_status": "confirmed",
      "availability": "full",
      "notes": "证明死亡结果和碰撞有关。"
    },
    {
      "evidence_id": "E4",
      "evidence_type": "witness_testimony",
      "content": "路人称电动车在路口附近有变道动作。",
      "source_actor": "证人",
      "collection_context": "课程项目结构化材料",
      "authenticity_status": "unknown",
      "availability": "summary_only",
      "notes": "观察位置和准确性待核查。"
    },
    {
      "evidence_id": "E5",
      "evidence_type": "defendant_statement",
      "content": "戊称已减速观察并及时制动。",
      "source_actor": "被告人",
      "collection_context": "课程项目结构化材料",
      "authenticity_status": "confirmed",
      "availability": "full",
      "notes": "缺少客观车辆数据印证。"
    }
  ],
  "procedure": {
    "current_stage": "case_analysis",
    "completed_actions": [
      "完成材料整理",
      "完成事实—证据—主张分离"
    ],
    "missing_or_disputed_actions": [
      "车辆事发前速度、制动时点和制动距离",
      "事故可避免性和双方行为贡献分析"
    ],
    "evidence_examination": [
      {
        "evidence_id": "E1",
        "status": "examined",
        "notes": "结论需要结合形成依据审查。"
      },
      {
        "evidence_id": "E2",
        "status": "examined",
        "notes": "不能准确判断速度、视距和制动时点。"
      },
      {
        "evidence_id": "E3",
        "status": "examined",
        "notes": "证明死亡结果和碰撞有关。"
      },
      {
        "evidence_id": "E4",
        "status": "disputed",
        "notes": "观察位置和准确性待核查。"
      },
      {
        "evidence_id": "E5",
        "status": "examined",
        "notes": "缺少客观车辆数据印证。"
      }
    ]
  },
  "role_views": {
    "clerk": {
      "fact_ids": [
        "F1",
        "F2",
        "F3",
        "F4",
        "F5"
      ],
      "claim_ids": [
        "C1",
        "C2",
        "C3"
      ],
      "evidence_ids": [
        "E1",
        "E2",
        "E3",
        "E4",
        "E5"
      ],
      "procedure_access": true,
      "notes": "负责保留事实来源与争议状态。"
    },
    "issue_spotter": {
      "fact_ids": [
        "F1",
        "F2",
        "F3",
        "F4",
        "F5"
      ],
      "claim_ids": [
        "C1",
        "C2",
        "C3"
      ],
      "evidence_ids": [
        "E1",
        "E2",
        "E3",
        "E4",
        "E5"
      ],
      "procedure_access": true,
      "notes": "只识别争点，不读取金标准。"
    },
    "prosecutor": {
      "fact_ids": [
        "F1",
        "F2",
        "F3",
        "F4",
        "F5"
      ],
      "claim_ids": [
        "C1",
        "C3"
      ],
      "evidence_ids": [
        "E1",
        "E2",
        "E3",
        "E4",
        "E5"
      ],
      "procedure_access": true,
      "notes": "读取证据而非预写完整答案。"
    },
    "defense_lawyer": {
      "fact_ids": [
        "F1",
        "F2",
        "F3",
        "F4",
        "F5"
      ],
      "claim_ids": [
        "C2",
        "C3"
      ],
      "evidence_ids": [
        "E1",
        "E2",
        "E3",
        "E4",
        "E5"
      ],
      "procedure_access": true,
      "notes": "读取证据而非预写完整答案。"
    },
    "defendant": {
      "fact_ids": [
        "F1",
        "F2",
        "F3",
        "F4",
        "F5"
      ],
      "claim_ids": [
        "C3"
      ],
      "evidence_ids": [
        "E1",
        "E2",
        "E3"
      ],
      "procedure_access": false,
      "notes": "限制为与本人陈述直接相关的材料。"
    },
    "judge": {
      "fact_ids": [
        "F1",
        "F2",
        "F3",
        "F4",
        "F5"
      ],
      "claim_ids": [
        "C1",
        "C2",
        "C3"
      ],
      "evidence_ids": [
        "E1",
        "E2",
        "E3",
        "E4",
        "E5"
      ],
      "procedure_access": true,
      "notes": "可查看双方结构化论证和全部证据。"
    },
    "reviewers": {
      "fact_ids": [
        "F1",
        "F2",
        "F3",
        "F4",
        "F5"
      ],
      "claim_ids": [
        "C1",
        "C2",
        "C3"
      ],
      "evidence_ids": [
        "E1",
        "E2",
        "E3",
        "E4",
        "E5"
      ],
      "procedure_access": true,
      "notes": "可查看双方论证和法官争点表。"
    },
    "foreperson": {
      "fact_ids": [
        "F1",
        "F2",
        "F3",
        "F4",
        "F5"
      ],
      "claim_ids": [
        "C1",
        "C2",
        "C3"
      ],
      "evidence_ids": [
        "E1",
        "E2",
        "E3",
        "E4",
        "E5"
      ],
      "procedure_access": true,
      "notes": "汇总两轮评议，不读取金标准。"
    },
    "writer": {
      "fact_ids": [
        "F1",
        "F2",
        "F3",
        "F4",
        "F5"
      ],
      "claim_ids": [
        "C1",
        "C2",
        "C3"
      ],
      "evidence_ids": [
        "E1",
        "E2",
        "E3",
        "E4",
        "E5"
      ],
      "procedure_access": true,
      "notes": "读取上游结构化输出，不读取金标准。"
    }
  },
  "metadata": {
    "difficulty": "hard",
    "paired_case_id": "criminal_004b",
    "pair_variant": "A",
    "target_capabilities": [
      "争点识别",
      "证据映射",
      "证据缺口发现",
      "不确定性保持",
      "最小对照敏感性"
    ],
    "created_by": [
      "项目组",
      "AI辅助初标",
      "法学背景成员复核"
    ],
    "review_status": "legal_reviewed"
  }
}