{
  "case_id": "criminal_005a",
  "version": "2.0",
  "language": "zh-CN",
  "task_mode": "teaching",
  "domain": {
    "jurisdiction": "中国",
    "case_category": "诈骗",
    "primary_issue_type": "mens_rea",
    "secondary_issue_types": [
      "证据可靠性",
      "不确定性校准"
    ]
  },
  "title": "投资失败与诈骗故意（项目真实）",
  "source": {
    "source_id": "PAIR05",
    "source_type": "synthetic",
    "citation": "基于原有教学案例、刑法构成要件与证据规则形成的控制变量合成案例",
    "url": "",
    "retrieval_date": "2026-06-16",
    "original_case_number": "",
    "adaptation_type": "minimal_pair_construction",
    "adaptation_notes": "保留同组案件的大部分事实，仅改变一个具有法律意义的关键变量，用于测试模型敏感性；不对应具体自然人或单一真实案件。",
    "anonymized": true
  },
  "case_narrative": {
    "neutral_summary": "庚向辛介绍农产品电商项目并承诺预计收益，辛转账八万元。项目公司真实登记，存在供应商合同和运营记录，约六成资金用于采购、推广和仓储。项目经营失败后庚持续汇报并归还一万元，其余款项未能按期返还。",
    "timeline": [
      {
        "event_id": "T1",
        "order": 1,
        "time_label": "阶段1",
        "content": "辛向庚转账八万元用于项目。；项目公司和供应商合同真实存在。；约六成资金用于项目采购、推广和仓储。",
        "fact_ids": [
          "F1",
          "F2",
          "F3"
        ]
      },
      {
        "event_id": "T2",
        "order": 2,
        "time_label": "阶段2",
        "content": "项目失败后庚持续沟通并归还一万元。；庚曾作出较乐观收益表述。",
        "fact_ids": [
          "F4",
          "F5"
        ]
      }
    ]
  },
  "participants": [
    {
      "participant_id": "P1",
      "role": "defendant",
      "anonymized_name": "被告人",
      "attributes": {
        "说明": "已匿名化"
      }
    },
    {
      "participant_id": "P2",
      "role": "victim",
      "anonymized_name": "被害人",
      "attributes": {
        "说明": "已匿名化"
      }
    }
  ],
  "facts": [
    {
      "fact_id": "F1",
      "content": "辛向庚转账八万元用于项目。",
      "status": "undisputed",
      "asserted_by": [
        "prosecution",
        "defense",
        "defendant"
      ],
      "evidence_ids": [
        "E1"
      ],
      "notes": "已将事实与各方评价分离。"
    },
    {
      "fact_id": "F2",
      "content": "项目公司和供应商合同真实存在。",
      "status": "undisputed",
      "asserted_by": [
        "prosecution",
        "defense",
        "defendant"
      ],
      "evidence_ids": [
        "E2"
      ],
      "notes": "已将事实与各方评价分离。"
    },
    {
      "fact_id": "F3",
      "content": "约六成资金用于项目采购、推广和仓储。",
      "status": "undisputed",
      "asserted_by": [
        "prosecution",
        "defense",
        "defendant"
      ],
      "evidence_ids": [
        "E3"
      ],
      "notes": "已将事实与各方评价分离。"
    },
    {
      "fact_id": "F4",
      "content": "项目失败后庚持续沟通并归还一万元。",
      "status": "undisputed",
      "asserted_by": [
        "prosecution",
        "defense",
        "defendant"
      ],
      "evidence_ids": [
        "E4"
      ],
      "notes": "已将事实与各方评价分离。"
    },
    {
      "fact_id": "F5",
      "content": "庚曾作出较乐观收益表述。",
      "status": "undisputed",
      "asserted_by": [
        "prosecution",
        "defense",
        "defendant"
      ],
      "evidence_ids": [
        "E5"
      ],
      "notes": "已将事实与各方评价分离。"
    }
  ],
  "claims": [
    {
      "claim_id": "C1",
      "actor_role": "prosecution",
      "content": "庚夸大收益并未按约返还资金，部分款项去向不明。",
      "supporting_evidence_ids": [
        "E1",
        "E2",
        "E3"
      ],
      "claim_status": "asserted"
    },
    {
      "claim_id": "C2",
      "actor_role": "defense",
      "content": "项目真实且大部分资金用于经营，持续汇报和部分还款削弱收款时非法占有目的推断。",
      "supporting_evidence_ids": [
        "E1",
        "E2",
        "E3",
        "E4",
        "E5"
      ],
      "claim_status": "asserted"
    },
    {
      "claim_id": "C3",
      "actor_role": "defendant",
      "content": "庚称项目真实，只是经营失败，愿意继续还款。",
      "supporting_evidence_ids": [
        "E3"
      ],
      "claim_status": "asserted"
    }
  ],
  "evidence": [
    {
      "evidence_id": "E1",
      "evidence_type": "documentary",
      "content": "转账记录和双方投资约定。",
      "source_actor": "双方",
      "collection_context": "课程项目结构化材料",
      "authenticity_status": "confirmed",
      "availability": "full",
      "notes": "证明资金交付和约定内容。"
    },
    {
      "evidence_id": "E2",
      "evidence_type": "documentary",
      "content": "公司登记、供应商合同及仓储资料。",
      "source_actor": "项目公司",
      "collection_context": "课程项目结构化材料",
      "authenticity_status": "confirmed",
      "availability": "full",
      "notes": "证明项目并非虚构。"
    },
    {
      "evidence_id": "E3",
      "evidence_type": "documentary",
      "content": "资金明细显示约六成用于项目支出。",
      "source_actor": "银行及项目公司",
      "collection_context": "课程项目结构化材料",
      "authenticity_status": "confirmed",
      "availability": "full",
      "notes": "部分款项去向仍需解释。"
    },
    {
      "evidence_id": "E4",
      "evidence_type": "electronic_data",
      "content": "项目进度汇报、协商延期和一万元还款记录。",
      "source_actor": "双方",
      "collection_context": "课程项目结构化材料",
      "authenticity_status": "confirmed",
      "availability": "full",
      "notes": "支持经营失败后仍在履行和协商。"
    },
    {
      "evidence_id": "E5",
      "evidence_type": "electronic_data",
      "content": "庚曾承诺较高预期收益，但也提及经营风险。",
      "source_actor": "双方",
      "collection_context": "课程项目结构化材料",
      "authenticity_status": "confirmed",
      "availability": "full",
      "notes": "不是完全无条件保本承诺。"
    }
  ],
  "procedure": {
    "current_stage": "case_analysis",
    "completed_actions": [
      "完成材料整理",
      "完成事实—证据—主张分离"
    ],
    "missing_or_disputed_actions": [
      "剩余资金的完整去向和个人消费比例",
      "双方对收益、风险和本金保障的完整沟通"
    ],
    "evidence_examination": [
      {
        "evidence_id": "E1",
        "status": "examined",
        "notes": "证明资金交付和约定内容。"
      },
      {
        "evidence_id": "E2",
        "status": "examined",
        "notes": "证明项目并非虚构。"
      },
      {
        "evidence_id": "E3",
        "status": "examined",
        "notes": "部分款项去向仍需解释。"
      },
      {
        "evidence_id": "E4",
        "status": "examined",
        "notes": "支持经营失败后仍在履行和协商。"
      },
      {
        "evidence_id": "E5",
        "status": "examined",
        "notes": "不是完全无条件保本承诺。"
      }
    ]
  },
  "role_views": {
    "clerk": {
      "fact_ids": [
        "F1",
        "F2",
        "F3",
        "F4",
        "F5"
      ],
      "claim_ids": [
        "C1",
        "C2",
        "C3"
      ],
      "evidence_ids": [
        "E1",
        "E2",
        "E3",
        "E4",
        "E5"
      ],
      "procedure_access": true,
      "notes": "负责保留事实来源与争议状态。"
    },
    "issue_spotter": {
      "fact_ids": [
        "F1",
        "F2",
        "F3",
        "F4",
        "F5"
      ],
      "claim_ids": [
        "C1",
        "C2",
        "C3"
      ],
      "evidence_ids": [
        "E1",
        "E2",
        "E3",
        "E4",
        "E5"
      ],
      "procedure_access": true,
      "notes": "只识别争点，不读取金标准。"
    },
    "prosecutor": {
      "fact_ids": [
        "F1",
        "F2",
        "F3",
        "F4",
        "F5"
      ],
      "claim_ids": [
        "C1",
        "C3"
      ],
      "evidence_ids": [
        "E1",
        "E2",
        "E3",
        "E4",
        "E5"
      ],
      "procedure_access": true,
      "notes": "读取证据而非预写完整答案。"
    },
    "defense_lawyer": {
      "fact_ids": [
        "F1",
        "F2",
        "F3",
        "F4",
        "F5"
      ],
      "claim_ids": [
        "C2",
        "C3"
      ],
      "evidence_ids": [
        "E1",
        "E2",
        "E3",
        "E4",
        "E5"
      ],
      "procedure_access": true,
      "notes": "读取证据而非预写完整答案。"
    },
    "defendant": {
      "fact_ids": [
        "F1",
        "F2",
        "F3",
        "F4",
        "F5"
      ],
      "claim_ids": [
        "C3"
      ],
      "evidence_ids": [
        "E1",
        "E2",
        "E3"
      ],
      "procedure_access": false,
      "notes": "限制为与本人陈述直接相关的材料。"
    },
    "judge": {
      "fact_ids": [
        "F1",
        "F2",
        "F3",
        "F4",
        "F5"
      ],
      "claim_ids": [
        "C1",
        "C2",
        "C3"
      ],
      "evidence_ids": [
        "E1",
        "E2",
        "E3",
        "E4",
        "E5"
      ],
      "procedure_access": true,
      "notes": "可查看双方结构化论证和全部证据。"
    },
    "reviewers": {
      "fact_ids": [
        "F1",
        "F2",
        "F3",
        "F4",
        "F5"
      ],
      "claim_ids": [
        "C1",
        "C2",
        "C3"
      ],
      "evidence_ids": [
        "E1",
        "E2",
        "E3",
        "E4",
        "E5"
      ],
      "procedure_access": true,
      "notes": "可查看双方论证和法官争点表。"
    },
    "foreperson": {
      "fact_ids": [
        "F1",
        "F2",
        "F3",
        "F4",
        "F5"
      ],
      "claim_ids": [
        "C1",
        "C2",
        "C3"
      ],
      "evidence_ids": [
        "E1",
        "E2",
        "E3",
        "E4",
        "E5"
      ],
      "procedure_access": true,
      "notes": "汇总两轮评议，不读取金标准。"
    },
    "writer": {
      "fact_ids": [
        "F1",
        "F2",
        "F3",
        "F4",
        "F5"
      ],
      "claim_ids": [
        "C1",
        "C2",
        "C3"
      ],
      "evidence_ids": [
        "E1",
        "E2",
        "E3",
        "E4",
        "E5"
      ],
      "procedure_access": true,
      "notes": "读取上游结构化输出，不读取金标准。"
    }
  },
  "metadata": {
    "difficulty": "hard",
    "paired_case_id": "criminal_005b",
    "pair_variant": "A",
    "target_capabilities": [
      "争点识别",
      "证据映射",
      "证据缺口发现",
      "不确定性保持",
      "最小对照敏感性"
    ],
    "created_by": [
      "项目组",
      "AI辅助初标",
      "法学背景成员复核"
    ],
    "review_status": "legal_reviewed"
  }
}